{
  "$schema": "http://json-schema.org/draft-07/schema#",
  "title": "PublicCv",
  "type": "object",
  "additionalProperties": false,
  "required": ["version", "approvals", "identity", "headline", "summary", "contacts", "skills", "experience", "projects", "education", "languages"],
  "properties": {
    "version": { "type": "string" },
    "approvals": {
      "type": "object",
      "additionalProperties": false,
      "required": ["email", "phone", "location", "linkedin", "github", "portrait"],
      "properties": {
        "email": { "type": "boolean" },
        "phone": { "type": "boolean" },
        "location": { "type": "boolean" },
        "linkedin": { "type": "boolean" },
        "github": { "type": "boolean" },
        "portrait": { "type": "boolean" }
      }
    },
    "identity": {
      "type": "object",
      "additionalProperties": false,
      "required": ["name"],
      "properties": {
        "name": { "type": "string", "minLength": 1 }
      }
    },
    "headline": {
      "type": "object",
      "additionalProperties": false,
      "required": ["fr", "en"],
      "properties": {
        "fr": { "type": "string" },
        "en": { "type": "string" }
      }
    },
    "summary": {
      "type": "object",
      "additionalProperties": false,
      "required": ["fr", "en"],
      "properties": {
        "fr": { "type": "string" },
        "en": { "type": "string" }
      }
    },
    "availability": {
      "type": "object",
      "additionalProperties": false,
      "properties": {
        "fr": { "type": "string" },
        "en": { "type": "string" }
      }
    },
    "contacts": {
      "type": "object",
      "additionalProperties": false,
      "properties": {
        "email": { "type": "string" },
        "phone": { "type": "string" },
        "location": { "type": "string" },
        "linkedin": { "type": "string" },
        "github": { "type": "string" },
        "portfolio": { "type": "string" }
      }
    },
    "skills": {
      "type": "array",
      "items": {
        "type": "object",
        "additionalProperties": false,
        "required": ["label", "items"],
        "properties": {
          "label": {
            "type": "object",
            "additionalProperties": false,
            "required": ["fr", "en"],
            "properties": { "fr": { "type": "string" }, "en": { "type": "string" } }
          },
          "items": { "type": "array", "items": { "type": "string" } }
        }
      }
    },
    "experience": {
      "type": "array",
      "items": {
        "type": "object",
        "additionalProperties": false,
        "required": ["period", "title", "org", "bullets"],
        "properties": {
          "period": { "type": "string" },
          "title": {
            "type": "object",
            "additionalProperties": false,
            "required": ["fr", "en"],
            "properties": { "fr": { "type": "string" }, "en": { "type": "string" } }
          },
          "org": { "type": "string" },
          "place": { "type": "string" },
          "bullets": {
            "type": "object",
            "additionalProperties": false,
            "required": ["fr", "en"],
            "properties": {
              "fr": { "type": "array", "items": { "type": "string" } },
              "en": { "type": "array", "items": { "type": "string" } }
            }
          }
        }
      }
    },
    "projects": {
      "type": "array",
      "items": {
        "type": "object",
        "additionalProperties": false,
        "required": ["name", "year", "stack", "summary"],
        "properties": {
          "name": { "type": "string" },
          "year": { "type": "string" },
          "stack": { "type": "string" },
          "summary": {
            "type": "object",
            "additionalProperties": false,
            "required": ["fr", "en"],
            "properties": { "fr": { "type": "string" }, "en": { "type": "string" } }
          }
        }
      }
    },
    "education": {
      "type": "array",
      "items": {
        "type": "object",
        "additionalProperties": false,
        "required": ["period", "title", "school"],
        "properties": {
          "period": { "type": "string" },
          "title": {
            "type": "object",
            "additionalProperties": false,
            "required": ["fr", "en"],
            "properties": { "fr": { "type": "string" }, "en": { "type": "string" } }
          },
          "school": { "type": "string" },
          "note": {
            "type": "object",
            "additionalProperties": false,
            "properties": { "fr": { "type": "string" }, "en": { "type": "string" } }
          }
        }
      }
    },
    "languages": {
      "type": "array",
      "items": {
        "type": "object",
        "additionalProperties": false,
        "required": ["name", "level"],
        "properties": {
          "name": {
            "type": "object",
            "additionalProperties": false,
            "required": ["fr", "en"],
            "properties": { "fr": { "type": "string" }, "en": { "type": "string" } }
          },
          "level": {
            "type": "object",
            "additionalProperties": false,
            "required": ["fr", "en"],
            "properties": { "fr": { "type": "string" }, "en": { "type": "string" } }
          }
        }
      }
    },
    "engagement": {
      "type": "array",
      "items": {
        "type": "object",
        "additionalProperties": false,
        "required": ["title", "detail"],
        "properties": {
          "title": {
            "type": "object",
            "additionalProperties": false,
            "required": ["fr", "en"],
            "properties": { "fr": { "type": "string" }, "en": { "type": "string" } }
          },
          "detail": {
            "type": "object",
            "additionalProperties": false,
            "required": ["fr", "en"],
            "properties": { "fr": { "type": "string" }, "en": { "type": "string" } }
          }
        }
      }
    },
    "certifications": {
      "type": "array",
      "items": { "type": "string" }
    }
  }
}
